{
  "$schema": "../../docs/contracts/schemas/golden-estimate-v1.schema.json",
  "contractVersion": "golden-estimate.v1",
  "id": "GE-002",
  "title": "room-with-lights-and-chandelier",
  "source": "synthetic_stub",
  "approvalStatus": "engineering_fixture_not_pilot_price",
  "vertical": "ceiling",
  "calculationDate": "2026-05-23",
  "input": {
    "normalizedParams": {
      "region": "synthetic_region",
      "city": "synthetic_city",
      "roomType": "living_room",
      "areaSqm": "18.0",
      "perimeterM": "17.0",
      "shape": "rectangle",
      "fabricType": "pvc",
      "fabricBrand": "synthetic_standard",
      "cornersCount": 4,
      "heightM": "2.75",
      "spotLightsCount": 6,
      "chandelierCount": 1
    },
    "formulaVersion": "ceiling.v1"
  },
  "snapshots": {
    "priceBookSnapshotRef": "fixtures/price-books/ceiling-basic-v1.json",
    "coefficientSnapshotRef": "fixtures/coefficients/ceiling-basic-v1.json",
    "tenantPricingProfileSnapshotRef": "fixtures/pricing-profiles/default-v1.json",
    "markupPolicySnapshotRef": "fixtures/markup-policies/default-v1.json"
  },
  "expected": {
    "completenessStatus": "complete",
    "missingBlocks": [],
    "variants": {
      "economy": { "status": "complete", "finalTotal": { "amountMinor": "3110000", "currency": "RUB" } },
      "standard": { "status": "complete", "finalTotal": { "amountMinor": "4040000", "currency": "RUB" } },
      "premium": { "status": "complete", "finalTotal": { "amountMinor": "5900000", "currency": "RUB" } }
    },
    "riskFlags": [],
    "requiredAuditRules": ["ceiling.v1.area", "ceiling.v1.materials", "ceiling.v1.work", "ceiling.v1.fixed-lines", "ceiling.v1.variants", "ceiling.v1.rounding"]
  },
  "assertions": {
    "variantOrder": "economy_lt_standard_lt_premium",
    "deterministicRuns": 100,
    "moneyToleranceMinor": "0",
    "noFloatMoney": true
  },
  "notes": "Synthetic engineering oracle with lighting lines. Not a real pilot price."
}
