{
  "$schema": "../../docs/contracts/schemas/golden-estimate-v1.schema.json",
  "contractVersion": "golden-estimate.v1",
  "id": "GE-004",
  "title": "complex-shape-missing-perimeter-partial",
  "source": "synthetic_stub",
  "approvalStatus": "engineering_fixture_not_pilot_price",
  "vertical": "ceiling",
  "calculationDate": "2026-05-23",
  "input": {
    "normalizedParams": {
      "region": "synthetic_region",
      "city": "synthetic_city",
      "roomType": "living_room",
      "areaSqm": "22.0",
      "shape": "complex_polygon",
      "fabricType": "pvc",
      "fabricBrand": "synthetic_standard",
      "cornersCount": 8,
      "heightM": "2.80",
      "spotLightsCount": 0,
      "chandelierCount": 0
    },
    "formulaVersion": "ceiling.v1"
  },
  "snapshots": {
    "priceBookSnapshotRef": "fixtures/price-books/ceiling-basic-v1.json",
    "coefficientSnapshotRef": "fixtures/coefficients/ceiling-basic-v1.json",
    "tenantPricingProfileSnapshotRef": "fixtures/pricing-profiles/default-v1.json",
    "markupPolicySnapshotRef": "fixtures/markup-policies/default-v1.json"
  },
  "expected": {
    "completenessStatus": "partial",
    "missingBlocks": ["perimeter_for_complex_geometry"],
    "variants": {
      "economy": { "status": "partial", "knownSubtotal": { "amountMinor": "1300000", "currency": "RUB" }, "finalTotal": null },
      "standard": { "status": "partial", "knownSubtotal": { "amountMinor": "1960000", "currency": "RUB" }, "finalTotal": null },
      "premium": { "status": "partial", "knownSubtotal": { "amountMinor": "3280000", "currency": "RUB" }, "finalTotal": null }
    },
    "riskFlags": ["complex_geometry_without_perimeter_requires_measurement"],
    "requiredAuditRules": ["ceiling.v1.area", "ceiling.v1.materials", "ceiling.v1.partial-rules"]
  },
  "assertions": {
    "variantOrder": "partial_no_final_total",
    "deterministicRuns": 100,
    "moneyToleranceMinor": "0",
    "noFloatMoney": true
  },
  "notes": "Partial estimate oracle. UI/PDF must not present knownSubtotal as final total."
}
