{
  "$schema": "../../docs/contracts/schemas/golden-estimate-v1.schema.json",
  "contractVersion": "golden-estimate.v1",
  "id": "GE-003",
  "title": "small-bathroom-minimum-order",
  "source": "synthetic_stub",
  "approvalStatus": "engineering_fixture_not_pilot_price",
  "vertical": "ceiling",
  "calculationDate": "2026-05-23",
  "input": {
    "normalizedParams": {
      "region": "synthetic_region",
      "city": "synthetic_city",
      "roomType": "bathroom",
      "areaSqm": "4.0",
      "perimeterM": "8.0",
      "shape": "rectangle",
      "fabricType": "pvc",
      "fabricBrand": "synthetic_standard",
      "cornersCount": 4,
      "heightM": "2.60",
      "spotLightsCount": 0,
      "chandelierCount": 0
    },
    "formulaVersion": "ceiling.v1"
  },
  "snapshots": {
    "priceBookSnapshotRef": "fixtures/price-books/ceiling-basic-v1.json",
    "coefficientSnapshotRef": "fixtures/coefficients/ceiling-basic-v1.json",
    "tenantPricingProfileSnapshotRef": "fixtures/pricing-profiles/default-v1.json",
    "markupPolicySnapshotRef": "fixtures/markup-policies/default-v1.json"
  },
  "expected": {
    "completenessStatus": "complete",
    "missingBlocks": [],
    "variants": {
      "economy": { "status": "complete", "finalTotal": { "amountMinor": "1800000", "currency": "RUB" } },
      "standard": { "status": "complete", "finalTotal": { "amountMinor": "1800000", "currency": "RUB" } },
      "premium": { "status": "complete", "finalTotal": { "amountMinor": "1800000", "currency": "RUB" } }
    },
    "riskFlags": [],
    "requiredAuditRules": ["ceiling.v1.area", "ceiling.v1.materials", "ceiling.v1.work", "ceiling.v1.minimum-order"]
  },
  "assertions": {
    "variantOrder": "all_equal_due_minimum_order",
    "deterministicRuns": 100,
    "moneyToleranceMinor": "0",
    "noFloatMoney": true
  },
  "notes": "Synthetic minimum-order oracle. Not a real pilot price."
}
